{
  "$schema": "https://json-schema.org/draft/2020-12/schema",
  "$id": "https://github.com/mbta/schemas/blob/main/schemas/com.mbta.ctd.glides.operator_signed_in.v1.json",
  "description": "Operator Signed In",
  "type": "object",
  "properties": {
    "type": { "const": "com.mbta.ctd.glides.operator_signed_in.v1" },
    "specversion": { "const": "1.0" },
    "source": { "$ref": "glides-events.json#/properties/source" },
    "id": { "$ref": "glides-events.json#/properties/id" },
    "time": { "$ref": "glides-events.json#/$defs/timestamp" },
    "data": {
      "type": "object",
      "properties": {
        "metadata": { "$ref": "glides-events.json#/$defs/metadata" },
        "operator": { "$ref": "glides-events.json#/$defs/operator" },
        "signedInAt": { "$ref": "glides-events.json#/$defs/timestamp" },
        "signature": { "$ref": "#/$defs/signature" }
      },
      "required": ["metadata"]
    }
  },
  "required": ["type", "specversion", "source", "id", "time", "data"],
  "$defs": {
    "signature": {
      "type": "object",
      "properties": {
        "type": {
          "type": "string",
          "examples": ["tap", "type"]
        }
      }
    }
  }
}
